{
  "format": "relven.plan",
  "schemaVersion": 1,
  "id": "bodyweight-foundation-2026",
  "name": "Bodyweight foundation",
  "timezone": "Europe/Stockholm",
  "workouts": [
    {
      "schemaVersion": 3,
      "id": "strength-a",
      "name": "Strength basics",
      "sport": "strength",
      "steps": [
        {
          "id": "squat-step",
          "kind": "segment",
          "phase": "work",
          "end": {
            "type": "manual"
          },
          "exercise": {
            "exerciseId": "3b0e6f4b-9252-4e8c-96e5-7df5e0bb18d0",
            "libraryRevision": 2,
            "snapshot": {
              "name": "Bodyweight squat",
              "instructions": "Stand with your feet about shoulder-width apart.\nBend your knees and hips as far as comfortable while keeping your chest lifted.\nPress through your feet to stand tall again.",
              "equipment": [],
              "images": []
            },
            "sets": 3,
            "minRepetitions": 8,
            "maxRepetitions": 12,
            "restSeconds": 60,
            "exerciseRevision": 1
          }
        },
        {
          "id": "pushup-step",
          "kind": "segment",
          "phase": "work",
          "end": {
            "type": "manual"
          },
          "exercise": {
            "exerciseId": "09a2a7b3-0798-4ef8-98a8-02a446068ee0",
            "libraryRevision": 2,
            "snapshot": {
              "name": "Push-up",
              "instructions": "Start in a high plank with hands under or just outside your shoulders.\nKeep your body in a comfortable straight line and lower your chest toward the floor.\nPress the floor away to return to the start.",
              "equipment": [],
              "images": []
            },
            "sets": 3,
            "minRepetitions": 6,
            "maxRepetitions": 12,
            "restSeconds": 60,
            "exerciseRevision": 1
          }
        }
      ]
    },
    {
      "schemaVersion": 3,
      "id": "prehab-a",
      "name": "Movement preparation",
      "sport": "prehab",
      "steps": [
        {
          "id": "glute-bridge-step",
          "kind": "segment",
          "phase": "warmup",
          "end": {
            "type": "time",
            "seconds": 90
          },
          "exercise": {
            "exerciseId": "a112bc26-c38c-45c8-a855-6bb8b412daf2",
            "libraryRevision": 2,
            "snapshot": {
              "name": "Glute bridge",
              "instructions": "Lie on your back with knees bent and feet flat on the floor.\nGently brace your middle and lift your hips until your body forms a comfortable line from shoulders to knees.\nLower your hips with control.",
              "equipment": [],
              "images": []
            },
            "sets": 2,
            "minRepetitions": 10,
            "maxRepetitions": 15,
            "restSeconds": 30,
            "exerciseRevision": 1
          }
        }
      ]
    }
  ],
  "days": [
    {
      "id": "day-1",
      "date": "2026-10-20",
      "kind": "workout",
      "workoutId": "strength-a"
    },
    {
      "id": "day-2",
      "date": "2026-10-21",
      "kind": "rest"
    },
    {
      "id": "day-3",
      "date": "2026-10-22",
      "kind": "workout",
      "workoutId": "prehab-a"
    }
  ]
}
